objective,optional_context,name,headline,inferred_mbti,career_history_json,skills_pipe_delimited,recent_activity_pipe_delimited,company_updates_pipe_delimited
Pitch our AI-driven logistics optimization platform to reduce delivery times for Instamart.,Reference their recent $100M funding round and focus on operational efficiency.,Rohan Gupta,VP of Engineering at Swiggy | Scaling Food and Grocery Delivery,ENTJ,"[{""role"": ""VP of Engineering"", ""company"": ""Swiggy"", ""duration"": ""2021 - Present"", ""description"": ""Leading the engineering teams for Swiggy Instamart, focusing on scalable systems, real-time logistics, and inventory management.""}]",System Design|Distributed Systems|Go (Programming Language)|Leadership|Logistics Tech,Q3 engineering metrics are in. We've hit 99.99% uptime while cutting cloud costs by 15%. This is the result of strategic architectural decisions and ruthless prioritization. We don't just build; we execute. #Leadership #Engineering #Strategy,Swiggy raises $100M in new funding round to expand Instamart operations across Tier 2 cities.
Introduce our influencer-generated content (IGC) platform to scale authentic video reviews for new product lines.,Emphasize the 'authenticity' and 'community' aspects she values.,Priya Mehta,Senior Content Strategist at Nykaa,INFP,"[{""role"": ""Senior Content Strategist"", ""company"": ""Nykaa"", ""duration"": ""2019 - Present"", ""description"": ""Crafting brand stories and building a community around beauty and self-expression. Leading content for our new skincare verticals.""}]",Content Strategy|Brand Storytelling|SEO|Social Media Marketing|Community Building,"Just published a new blog post on 'The 'Why' Behind Beauty.' It's not just about products, but about self-expression and finding your unique voice. I feel so lucky to connect with our community on this deeper level. #ContentMarketing #BrandStorytelling #Values","Nykaa launches a new line of sustainable, eco-friendly skincare products."
Sell our new automated regulatory reporting (RegTech) software to streamline their compliance process.,Highlight the 100% accuracy and data integrity features.,Rajesh Kumar,Senior Financial Auditor at HDFC Bank,ISTJ,"[{""role"": ""Senior Financial Auditor"", ""company"": ""HDFC Bank"", ""duration"": ""2015 - Present"", ""description"": ""Ensuring regulatory compliance (RBI) and internal financial controls. Specializing in risk assessment and process auditing.""}]",Internal Audit|Risk Management|Financial Compliance|RBI Regulations|Data Analysis,Completed the quarterly compliance audit for our retail banking division. All processes are verified and documented as per the latest RBI circular. A clean ledger is the foundation of trust. #Finance #Audit #Compliance #DetailsMatter,"HDFC Bank posts strong Q3 results, beating profit estimates on lower-than-expected NPAs."
Offer our scalable cloud infrastructure and DevOps consulting package to support their rapid growth.,Mention our experience with high-transaction fintech platforms.,Arjun Singh,Founder & CTO at FintechInnovate | Disrupting Payments,ENTP,"[{""role"": ""Founder & CTO"", ""company"": ""FintechInnovate"", ""duration"": ""2022 - Present"", ""description"": ""Building the next generation of payment gateways for Indian SMEs.""}]",Fintech|Product Strategy|Node.js|AWS|System Architecture,"Hot take: Is the traditional banking model completely obsolete? We're building something that challenges the entire premise of 'savings'. What if your money could actively work for you, 24/7, without a human in the loop? #Fintech #Disruption #Innovation",FintechInnovate named one of India's top 50 emerging startups by TechCrunch.
Pitch our new AI-powered employee wellness and engagement platform to help TCS retain top talent.,Connect the pitch to her post about the 'Great Place to Work' certification.,Meera Reddy,HR Business Partner at Tata Consultancy Services (TCS),ESFJ,"[{""role"": ""HR Business Partner"", ""company"": ""Tata Consultancy Services"", ""duration"": ""2018 - Present"", ""description"": ""Partnering with business unit heads to manage the employee lifecycle, from talent acquisition to retention and development.""}]",Talent Management|Employee Engagement|HR Strategy|Performance Management,"So incredibly proud to announce our team's 'Great Place to Work' certification! This belongs to all 500,000+ members of our TCS family. Building a supportive and collaborative environment is my top priority! #Teamwork #HR #CompanyCulture #TCS",TCS secures major 10-year digital transformation deal with a European banking giant.
Introduce our developer-first API observability platform to help debug complex microservices faster.,Focus on the logical elegance and deep-dive diagnostic tools.,Vikram Chen,Staff Software Engineer at PhonePe,INTP,"[{""role"": ""Staff Software Engineer"", ""company"": ""PhonePe"", ""duration"": ""2019 - Present"", ""description"": ""Designing and implementing high-availability, low-latency microservices for the core payments processing system.""}]",Java|Spring Boot|Microservices|Kafka|System Design|Fintech,Spent the weekend debugging a race condition in our payments service. Interesting challenge. It seems the original architecture didn't account for asynchronous event scaling. Refactoring it with a message queue (Kafka) seems like the most logical path forward. The elegance of a decoupled system is always satisfying. #SoftwareArchitecture #ProblemSolving #Kafka,PhonePe becomes the first app to cross 5 billion transactions in a single month on UPI.
Propose our generative AI content creation engine to help their team scale marketing assets.,Connect to his recent post about the brainstorming session.,Karan Sharma,Digital Marketing Lead at Zomato,ENFP,"[{""role"": ""Digital Marketing Lead"", ""company"": ""Zomato"", ""duration"": ""2020 - Present"", ""description"": ""Driving user acquisition and retention through innovative digital campaigns, social media, and performance marketing.""}]",Digital Marketing|Performance Marketing|SEO/SEM|Social Media|Creative Strategy,Brainstormed so many amazing ideas with the team for the new Zomato Gold launch! What if we connected our app to... The possibilities are endless! Love the creative energy here. #Marketing #Brainstorming #Zomato,Zomato rebrands its 'Pro' subscription to 'Zomato Gold' with new merchant partnerships.
Offer our automated cybersecurity compliance and auditing tool.,"Highlight its capability to manage complex, multi-cloud environments like the one Infosys manages for clients.",Aditya Verma,Principal Cloud Architect at Infosys,INTJ,"[{""role"": ""Principal Cloud Architect"", ""company"": ""Infosys"", ""duration"": ""2017 - Present"", ""description"": ""Designing and implementing secure, scalable multi-cloud strategies (AWS, Azure, GCP) for Fortune 500 clients.""}]",Cloud Architecture|AWS|Azure|GCP|Cybersecurity|Solution Design,"The current enterprise cloud security model is fundamentally inefficient. We need to move from perimeter-based defense to a zero-trust architecture. I've drafted a new framework for our clients that solves for identity, data, and infrastructure. #CloudSecurity #ZeroTrust #Architecture",Infosys partners with AWS to launch new generative AI-driven analytics platform.
Pitch our automated testing and QA platform to integrate into their CI/CD pipeline.,Reference his post on server issues and emphasize 'reliability'.,Sameer Das,DevOps Engineer at Razorpay,ISTP,"[{""role"": ""DevOps Engineer"", ""company"": ""Razorpay"", ""duration"": ""2021 - Present"", ""description"": ""Managing CI/CD pipelines, Kubernetes orchestration, and ensuring 99.999% uptime for payment services.""}]",DevOps|Kubernetes|AWS|CI/CD|Terraform|Site Reliability Engineering,"The payment gateway server was down for 3 minutes at 2 AM. Took the whole thing apart. Found a memory leak in a new deployment. Rolled it back, patched, and redeployed. Back online. #DevOps #SRE #ProblemSolving",Razorpay launches a new 'Magic Checkout' solution to improve e-commerce conversions.
Propose our executive leadership coaching program for high-potential managers.,Connect to his mission-driven post about leadership.,Anand Krishnan,Director of People & Culture at Cred,ENFJ,"[{""role"": ""Director of People & Culture"", ""company"": ""Cred"", ""duration"": ""2019 - Present"", ""description"": ""Building a high-performance, mission-driven culture. Leading talent strategy and organizational design.""}]",Organizational Design|Leadership Development|Company Culture|Talent Strategy,Truly inspired by our team's alignment with the new mission. It's not just about building an app; it's about changing how India thinks about credit. Empowering our leaders to carry this vision is my most important role. #Leadership #Culture #Mission,Cred announces entry into the 'Cred Mint' investment and P2P lending space.
Pitch our AI-powered product recommendation engine to enhance UI/UX and increase AOV.,Reference her post on UI design and 'beauty'.,Aisha Khan,Product Designer (UI/UX) at Myntra,ISFP,"[{""role"": ""Product Designer"", ""company"": ""Myntra"", ""duration"": ""2020 - Present"", ""description"": ""Designing intuitive and beautiful user interfaces for the Myntra app, focusing on user engagement and conversion.""}]",UI/UX Design|Figma|User Research|Interaction Design|Design Thinking,"Found some quiet time to refactor the checkout flow. It's not just about making it functional, but making the experience feel seamless and beautiful. The details matter. #DesignThinking #UIUX #ProductDesign",Myntra's 'Big Fashion Festival' becomes its biggest sales event to date.
Sell our advanced fraud detection and risk analysis module for their lending platform.,Acknowledge his post on efficiency and highlight how our tool streamlines risk operations.,Vijay Mathur,Head of Operations at Zerodha,ESTJ,"[{""role"": ""Head of Operations"", ""company"": ""Zerodha"", ""duration"": ""2018 - Present"", ""description"": ""Overseeing all brokerage operations, including customer onboarding (KYC), trade settlements, and risk management.""}]",Operations Management|Risk Management|Fintech|Process Improvement|SEBI Compliance,Process is key. Our new SOP for Q4 will streamline customer onboarding and reduce KYC verification time by 30%. Efficiency isn't just a goal; it's a standard. Read the internal memo. #Operations #Fintech #Efficiency,"Zerodha's user base crosses 1.5 crore, solidifying its position as India's largest stock broker."
Offer our ethical AI consulting services to help build and audit their new models.,Directly reference her blog post on 'Ethical AI'.,Kavita Iyer,"Senior Data Scientist, AI Ethics at Wipro",INFJ,"[{""role"": ""Senior Data Scientist, AI Ethics"", ""company"": ""Wipro"", ""duration"": ""2019 - Present"", ""description"": ""Developing frameworks for responsible AI, focusing on fairness, transparency, and bias detection in machine learning models.""}]",Data Science|Machine Learning|Python|AI Ethics|Natural Language Processing (NLP),Wrote a blog post on building ethical AI. It's so important that our technology reflects our values and serves all communities equitably. The 'why' behind the algorithm is what matters most. #AIForGood #EthicalAI #DataScience,"Wipro commits $1B to developing its 'ai360' ecosystem and training all 250,000 employees in AI."
Introduce our rapid prototyping and user testing platform to help validate their new ideas faster.,Position it as a tool to help him build and pitch his ideas even quicker.,Ravi Patel,Product Manager at Urban Company,ESTP,"[{""role"": ""Product Manager"", ""company"": ""Urban Company"", ""duration"": ""2021 - Present"", ""description"": ""Leading the 'Home Services' vertical, focusing on new product launches and improving provider-side app experience.""}]",Product Management|Agile Methodologies|User Research|Go-to-Market Strategy|SQL,Spotted a market gap in the home-cleaning vertical. Built a quick prototype over the weekend. Pitched it this morning to leadership. Approved. Let's build. #StartupLife #ProductManagement #Action,Urban Company expands its operations to 10 new cities in India and Southeast Asia.
Pitch our automated compliance training module for BFSI.,"Emphasize how it helps protect client data, referencing her post.",Sunita Desai,Learning and Development Manager at ICICI Bank,ISFJ,"[{""role"": ""L&D Manager"", ""company"": ""ICICI Bank"", ""duration"": ""2017 - Present"", ""description"": ""Designing and delivering training programs for new hires and existing employees, focusing on banking regulations and customer service.""}]",Learning & Development|Corporate Training|Instructional Design|Compliance Training,Just a reminder to all banking staff: please complete your mandatory compliance training by EOD Friday. It's crucial for protecting our data and our clients. Thank you for your cooperation! #Training #Compliance #HR,"ICICI Bank launches a new digital banking platform, 'iMobile Pay 2.0', with enhanced security features."
Propose our multi-channel marketing attribution software to help them optimize their ad spend.,Highlight the 'bottom-line results' and 'data-driven' aspects.,Deepika Singh,Director of Marketing at Lenskart | Building a D2C Brand,ENTJ,"[{""role"": ""Director of Marketing"", ""company"": ""Lenskart"", ""duration"": ""2019 - Present"", ""description"": ""Leading a team of 30+ marketers across performance, brand, and retention. Responsible for P&L and user growth.""}]",Marketing Strategy|P&L Management|Performance Marketing|Brand Building|Team Leadership,"Our Q3 marketing results are in, and we've shattered our customer acquisition targets. This isn't luck; it's a testament to a data-driven strategy, relentless execution, and a team that refuses to settle. We identified the new market, pivoted our creative, and dominated. On to Q4. #MarketingStrategy #Leadership #Results","Lenskart opens its 1500th retail store in India, successfully blending online and offline (O2O) strategy."
Introduce our new data visualization and BI tool to help their team find insights faster.,Position it as a tool that's more precise and logical than competitors.,Sanjay Rao,Lead Data Analyst at Flipkart,INTP,"[{""role"": ""Lead Data Analyst"", ""company"": ""Flipkart"", ""duration"": ""2018 - Present"", ""description"": ""Analyzing customer behavior and sales data to inform product strategy. Building dashboards and models to predict trends.""}]",Data Analysis|SQL|Tableau|Python (Pandas)|E-commerce|Statistics,Interesting deep-dive into our 'Big Billion Days' sales data. Found a key anomaly in the correlation between discount percentages and cart abandonment rates. The initial hypothesis was wrong. The data suggests a different user behavior entirely. Need to investigate the causal model further. #DataScience #Analytics #Ecommerce,"Flipkart's 'Big Billion Days' sale clocks in over $5B in GMV, setting a new record."
Pitch our automated employee onboarding and HRIS platform.,"Emphasize how it frees up the HR team to focus on culture and people, not paperwork.",Ananya Sharma,Senior HR Manager at Wipro,ESFP,"[{""role"": ""Senior HR Manager"", ""company"": ""Wipro"", ""duration"": ""2016 - Present"", ""description"": ""Managing the end-to-end HR function for the digital services business unit, focusing on employee relations and talent retention.""}]",Human Resources|Employee Relations|Talent Management|HRIS|Onboarding,"What an amazing virtual onboarding session for our new batch of graduates! So much energy and enthusiasm. Welcome to the Wipro family, everyone! We are so excited to have you. #HR #Onboarding #CompanyCulture","Wipro mandates a hybrid work-from-office policy, with employees required to be in 3 days a week."
Offer our strategic consulting services for supply chain decarbonization.,Reference his post on the 'future' and 'new frameworks'.,Vikram Ahuja,Head of Strategy & Sustainability at Tata Steel,INTJ,"[{""role"": ""Head of Strategy & Sustainability"", ""company"": ""Tata Steel"", ""duration"": ""2020 - Present"", ""description"": ""Developing long-term corporate strategy, M&A, and leading the company's ESG and decarbonization initiatives.""}]",Corporate Strategy|Sustainability|ESG|M&A|Market Analysis,"The future of steel is green. The current blast furnace model is unsustainable. I've been developing a new framework for migrating our production to Electric Arc Furnaces (EAF) powered by renewable energy. This is a 20-year plan, and it's the only logical path forward. #Sustainability #Strategy #ESG",Tata Steel announces a £1.25 billion investment to build a new Electric Arc Furnace at its UK Port Talbot plant.
Sell our low-code/no-code platform to help them build internal tools faster.,Connect to his post on building prototypes and taking action.,Rohan Mehra,Lead Product Manager at Reliance Jio,ESTP,"[{""role"": ""Lead Product Manager"", ""company"": ""Reliance Jio"", ""duration"": ""2019 - Present"", ""description"": ""Leading product development for the MyJio app, focusing on user growth and integration of new services like JioCinema.""}]",Product Management|Agile|User Growth|A/B Testing|Mobile Applications,"The market won't wait. Saw a need for a better internal dashboard for our streaming metrics. Got the team together, built a quick prototype in 48 hours, and deployed it. Stop talking, start building. #ProductManagement #Action #Jio",JioCinema breaks global streaming records during the IPL cricket finals.
Pitch our hyper-personalization engine for their e-commerce platform.,Reference their 'creative' approach and how our tool can generate unique user journeys.,Nisha Agarwal,Marketing Manager at AJIO (Reliance Retail),ENFP,"[{""role"": ""Marketing Manager"", ""company"": ""AJIO"", ""duration"": ""2021 - Present"", ""description"": ""Running 360-degree marketing campaigns for new brand launches on the AJIO platform.""}]",Digital Marketing|Brand Management|Campaign Management|Social Media Marketing,Had so many inspiring ideas from our last creative brainstorm! We're planning a new campaign that connects fashion with personal identity. What if we built a 'style-finder' quiz that's actually... fun? The potential is amazing! #Marketing #Creativity #Fashion,AJIO onboards 50 new international fashion brands to its 'AJIO Luxe' platform.
Offer our fractional CFO and financial modeling services for their portfolio startups.,Focus on the 'proven systems' and 'accuracy' of our financial models.,Amit Gupta,Venture Partner at Sequoia Capital India,ISTJ,"[{""role"": ""Venture Partner"", ""company"": ""Sequoia Capital India"", ""duration"": ""2018 - Present"", ""description"": ""Investing in early-stage SaaS and Fintech startups. Providing strategic guidance on finance and operations.""}]",Venture Capital|Financial Modeling|DueDiligence|SaaS|Fintech|Startups,Completed our Q3 portfolio review. All financial reports have been audited and benchmarked. It's critical that our founders have accurate data and proven systems for financial tracking. Discipline is the bedrock of growth. #VC #Finance #Startups,Sequoia Capital India (now Peak XV Partners) announces a new $2.85B fund for India and Southeast Asia.
Introduce our AI-powered sales enablement tool to help their team prioritize leads and close deals faster.,Frame it as a 'strategic weapon' for his sales team.,Harish Iyer,Chief Revenue Officer (CRO) at L&T Infotech (LTI),ENTJ,"[{""role"": ""Chief Revenue Officer"", ""company"": ""L&T Infotech"", ""duration"": ""2020 - Present"", ""description"": ""Leading the global sales, marketing, and customer success organizations. Responsible for all revenue-generating activities.""}]",Sales Leadership|Go-to-Market Strategy|P&L Management|Enterprise Sales|Digital Transformation,Q3 was another record-breaking quarter. Our sales organization didn't just meet the target; we executed a flawless strategic plan to enter three new markets. Vision without execution is hallucination. Proud of the team. #Sales #Leadership #Results,"LTI and Mindtree complete their merger to form 'LTIMindtree', creating a new scaled-up IT services provider."
Propose our 'Ethical AI in Healthcare' workshop and certification for their R&D team.,Connect with her post about patient impact and 'why'.,Dr. Sunita Rao,AI/ML Research Lead at HealthifyMe,INFJ,"[{""role"": ""AI/ML Research Lead"", ""company"": ""HealthifyMe"", ""duration"": ""2019 - Present"", ""description"": ""Leading research on predictive models for health outcomes and personalized nutrition using user-generated data.""}]",Machine Learning|Deep Learning|Python|Healthcare AI|Data Privacy,"It's not just about the accuracy of our models, but the real-world impact on our users' health. Connecting with that 'why' – helping someone avoid diabetes, not just predicting a metric – is what truly matters. #AIForGood #HealthTech #DataScience",HealthifyMe's AI-powered 'Ria' chatbot crosses 10 million user interactions.
Offer our automated UI testing service that uses visual regression to catch bugs.,"Position it as a tool that appreciates the 'art' and 'feel' of design, not just the code.",Rohan Bhatia,Senior UI/UX Designer at Cred,ISFP,"[{""role"": ""Senior UI/UX Designer"", ""company"": ""Cred"", ""duration"": ""2020 - Present"", ""description"": ""Designing delightful and intuitive user experiences for the Cred app. Obsessed with pixel-perfect design and micro-interactions.""}]",UI/UX Design|Figma|Prototyping|User-Centered Design|Micro-interactions,"Spent the morning crafting a new button animation. It's subtle, but it just 'feels' right. The aesthetics of an app are just as important as the functionality. #Design #UIUX #Craft","Cred launches 'Cred Garage', a new platform for vehicle management and insurance."
Pitch our B2B account-based marketing (ABM) platform to help them target enterprise clients.,"Connect to his 'process-oriented' post and show how our platform creates a clear, repeatable process for high-value sales.",Gaurav Verma,Head of Enterprise Sales at HCLTech,ESTJ,"[{""role"": ""Head of Enterprise Sales (North America)"", ""company"": ""HCLTech"", ""duration"": ""2018 - Present"", ""description"": ""Leading the sales team for the US market, focusing on large-scale digital transformation and cloud services deals.""}]",Enterprise Sales|Sales Strategy|Key Account Management|Cloud Services|Team Leadership,The Q3 sales process review is complete. We've implemented a new 5-stage pipeline review process that will increase forecast accuracy by 25%. A disciplined process is the only way to achieve repeatable success. #Sales #Process #Leadership,HCLTech wins a $2.1 billion managed services deal with Verizon Business.
Introduce our AI-powered code refactoring and technical debt analysis tool.,Directly reference his post on legacy systems and the need for a 'logical' solution.,Alok Jain,Principal Engineer at MakeMyTrip,INTP,"[{""role"": ""Principal Engineer"", ""company"": ""MakeMyTrip"", ""duration"": ""2017 - Present"", ""description"": ""Architecting the next-gen booking platform. Focusing on performance, scalability, and modernizing legacy codebases.""}]",System Architecture|Java|Microservices|Performance Tuning|Technical Leadership,"Spent the week analyzing our legacy hotel booking service. The coupling is too tight, and it's creating performance bottlenecks. The most logical solution is to decompose it into smaller, domain-driven microservices. The technical debt has to be addressed. #SoftwareArchitecture #LegacyCode #Refactoring",MakeMyTrip partners with the Indian government to promote domestic tourism.
Sell our advanced threat intelligence platform to protect their banking infrastructure.,"Mention the 'hands-on' nature of our tool, which allows his team to proactively hunt for threats.",Kiran Bedi,Cybersecurity Analyst (Red Team) at Axis Bank,ISTP,"[{""role"": ""Cybersecurity Analyst"", ""company"": ""Axis Bank"", ""duration"": ""2021 - Present"", ""description"": ""Performing penetration testing and vulnerability assessments on the bank's digital infrastructure. Simulating real-world attacks.""}]",Penetration Testing|Cybersecurity|Red Teaming|Metasploit|Network Security,Found a critical vulnerability in a third-party payment API. Gained root access in under an hour. Patched and reported. Always fun to break things to make them stronger. #CyberSecurity #RedTeam #Hacking,"Axis Bank launches a new co-branded credit card with Samsung, integrating UPI payments."
Propose our leadership development and communication program for their technical leads.,"Frame it as a way to help their tech talent 'inspire' and 'lead' teams, not just manage projects.",Prakash Nair,"Director, Engineering Management at Google India",ENFJ,"[{""role"": ""Director, Engineering Management"", ""company"": ""Google"", ""duration"": ""2015 - Present"", ""description"": ""Leading multiple engineering teams for Google Pay in the NBU (Next Billion Users) market. Focusing on building and mentoring leaders.""}]",Engineering Management|Leadership|Product Strategy|Distributed Systems|Mobile Payments,What truly inspires me is seeing a junior engineer grow into a confident tech lead. My job isn't just to ship products; it's to build the next generation of leaders who will build products that help millions. #Leadership #Mentorship #Google,Google Pay (GPay) expands its partnership with NPCI to offer new credit-on-UPI features in India.
