objective,optional_context,name,headline,inferred_mbti,career_history_json,skills_pipe_delimited,recent_activity_pipe_delimited,company_updates_pipe_delimited
Offer our diversity and inclusion (D&I) consulting and workshops.,Connect to her post on building an inclusive 'family' and 'community'.,Rina Joseph,Chief People Officer at Upstox,ESFJ,"[{""role"": ""Chief People Officer"", ""company"": ""Upstox"", ""duration"": ""2020 - Present"", ""description"": ""Scaling the company culture during hyper-growth. Leading all HR functions including talent, D&I, and employee experience.""}]",Human Resources|Company Culture|Talent Acquisition|Diversity & Inclusion (D&I),We just celebrated our annual 'Upstox Family Day'! It was wonderful to see everyone come together. Building a company where everyone feels a sense of belonging and community is my number one goal. #HR #Culture #Team,"Upstox surpasses 1 crore users, becoming one of India's fastest-growing brokerage firms."
Introduce our AI-powered competitive intelligence tool.,Show how it can help him challenge existing market assumptions and find new 'angles'.,Sameer Tandon,Director of Strategy at OYO,ENTP,"[{""role"": ""Director of Strategy"", ""company"": ""OYO"", ""duration"": ""2019 - Present"", ""description"": ""Identifying new market opportunities, analyzing competitive landscapes, and advising leadership on long-term growth bets.""}]",Corporate Strategy|Market Analysis|Competitive Intelligence|Financial Modeling|M&A,Interesting debate in our strategy meeting today. Is the traditional hotel aggregation model dead? What if we pivot to a 'prop-tech' management model entirely? Challenging the core assumptions is the only way to innovate. #Strategy #Innovation #TravelTech,"OYO files for its IPO again, focusing on profitability and a smaller, more optimized portfolio."
Sell our data governance and privacy (GDPR/DPDP) compliance suite.,Reference his post on 'details' and 'protecting data' as key selling points.,Arun Kumar,IT Compliance & Risk Manager at Tech Mahindra,ISFJ,"[{""role"": ""IT Compliance Manager"", ""company"": ""Tech Mahindra"", ""duration"": ""2016 - Present"", ""description"": ""Ensuring all IT systems and client data handling adhere to international standards (ISO 27001, GDPR) and the new Indian DPDP Act.""}]",IT Compliance|Risk Management|ISO 27001|GDPR|Data Privacy|IT Audit,"With India's new DPDP Act coming into effect, I've spent the last month diligently reviewing all our data processing agreements. The details are critical. Protecting our clients' data is a non-negotiable responsibility. #Compliance #DataPrivacy #DPDP",Tech Mahindra announces a new Center of Excellence (CoE) for Quantum Computing.
Pitch our automated ad-creative generation platform to help scale their campaigns.,Highlight the 'fun' and 'energetic' creative templates.,Pooja Shah,Performance Marketing Specialist at Policybazaar,ESFP,"[{""role"": ""Performance Marketing Specialist"", ""company"": ""Policybazaar"", ""duration"": ""2022 - Present"", ""description"": ""Managing paid acquisition campaigns on Google and Facebook. Optimizing for CPL and CPC.""}]",Performance Marketing|Google Ads|Facebook Ads|SEM|Data Analysis,What an amazing offsite with the marketing team! So much energy and so many new ideas. Loved connecting with everyone. Back to hitting those CPL targets! #Marketing #Team #WorkLife,"Policybazaar's parent company, PB Fintech, reports its first-ever quarterly profit."
Offer our strategic consulting on entering the Tier 3 and Tier 4 markets.,"Acknowledge his post on 'challenging' the current model and present this as a new, disruptive idea.",Aditya Rao,Co-Founder & CEO at 'RuralFin' (Startup),ENTP,"[{""role"": ""Co-Founder & CEO"", ""company"": ""RuralFin"", ""duration"": ""2021 - Present"", ""description"": ""Building a fintech platform to provide micro-loans and financial services to rural India.""}]",Startups|Fintech|Product Strategy|Fundraising|Leadership,"Everyone is building for the top 10% of India. We're challenging that. The real, untapped market is the 500 million people in rural India. The problem is complex, but the idea is simple: financial inclusion for all. #Fintech #Impact #Startup",RuralFin raises $5M in a seed round led by Accel to expand its agent network.
Sell our AI-powered supply chain visibility and risk management platform.,Emphasize 'data integrity' and 'process' to align with his ISTJ preferences.,Rajesh Nair,Supply Chain Director at Sun Pharma,ISTJ,"[{""role"": ""Supply Chain Director"", ""company"": ""Sun Pharma"", ""duration"": ""2015 - Present"", ""description"": ""Managing end-to-end supply chain, from raw material procurement to distribution of finished pharmaceutical goods. Ensuring compliance.""}]",Supply Chain Management|Logistics|Procurement|Pharmaceuticals|SAP|Process Optimization,"Just completed our bi-annual audit of our distribution network. All shipment and temperature logs are 100% verified. In pharmaceuticals, there is no room for error. Process and accuracy are paramount. #SupplyChain #Pharma #Logistics","Sun Pharma receives USFDA approval for a new generic drug, opening up a $1B market."
Introduce our AI-driven customer sentiment analysis tool to help them improve their user feedback loop.,Connect to her post on 'empathy' and understanding the 'why' behind user behavior.,Meera Krishnan,Head of User Research at PhonePe,INFP,"[{""role"": ""Head of User Research"", ""company"": ""PhonePe"", ""duration"": ""2019 - Present"", ""description"": ""Leading the user research team to uncover deep insights about user behavior, needs, and pain points.""}]",User Research|Usability Testing|Qualitative Research|Design Thinking|Empathy,"Conducted a deeply insightful user interview session today. It's not just about what the user clicks, but *why*. Understanding their financial anxieties and hopes is key to building a product that truly serves them. Empathy is the core of good design. #UserResearch #DesignThinking #Fintech","PhonePe expands into financial services, launching new insurance and mutual fund products."
Offer our automated Kubernetes cost-optimization and right-sizing platform.,Reference his 'hands-on' post and show how our tool gives engineers direct control over resource management.,Karthik Reddy,Site Reliability Engineer (SRE) at Cred,ISTP,"[{""role"": ""SRE"", ""company"": ""Cred"", ""duration"": ""2021 - Present"", ""description"": ""Building and maintaining the Kubernetes-based infrastructure for Cred's services. Focusing on automation, observability, and reliability.""}]",SRE|Kubernetes|Go (Programming Language)|AWS|Prometheus|Terraform,"The K8s cluster was having scaling issues. Dug into the HPA and found a misconfigured metric. Tweaked the YAML, pushed the fix, and watched the pods scale perfectly. Nothing more satisfying than a well-tuned system. #Kubernetes #SRE #DevOps",Cred's new 'Cred Mint' P2P lending feature crosses 1000 Cr in AUM.
Pitch our design system management tool to help them maintain UI consistency at scale.,Align with his post about 'beauty' and 'craft'.,Arjun Varma,Lead Product Designer at Swiggy,ISFP,"[{""role"": ""Lead Product Designer"", ""company"": ""Swiggy"", ""duration"": ""2019 - Present"", ""description"": ""Leading the design for the core food delivery experience. Building and maintaining the 'Spoon' design system.""}]",Product Design|UI/UX|Figma|Design Systems|User Research|Interaction Design,Just shipped a new update to our design system. It's not just a component library; it's the language we use to build. Loved crafting the new color palettes and motion principles. It's art and science. #DesignSystems #UIUX #Craft,"Swiggy launches 'Swiggy One', a unified subscription plan for all its services including Instamart and Dineout."
Sell our advanced AI-driven talent sourcing platform to find passive candidates.,Highlight how it can help him build his team 'efficiently' and 'systematically'.,Siddharth Jain,Head of Talent Acquisition at Infosys,ESTJ,"[{""role"": ""Head of Talent Acquisition (India)"", ""company"": ""Infosys"", ""duration"": ""2018 - Present"", ""description"": ""Responsible for hiring strategy and execution for all business units in India, managing a team of 100+ recruiters.""}]",Talent Acquisition|Recruiting|HR Strategy|Employer Branding|Leadership,"Our Q3 hiring targets have been met and documented. We've implemented a new structured interview process that has improved our quality-of-hire metric by 15%. A clear, repeatable process is essential for scaling talent. #Recruiting #HR #Process","Infosys opens a new campus in Pune, plans to hire 5,000 new engineers."
Propose our global leadership and cross-cultural communication training for their executive team.,Connect to her post on 'building bridges' and her people-focused approach.,Anjali Deshpande,Chief Human Resources Officer (CHRO) at LTIMindtree,ESFJ,"[{""role"": ""CHRO"", ""company"": ""LTIMindtree"", ""duration"": ""2023 - Present"", ""description"": ""Leading the post-merger cultural integration of LTI and Mindtree. Responsible for global HR strategy and talent management.""}]",Human Resources|Mergers & Acquisitions (M&A)|Cultural Integration|Organizational Design|Leadership,"So proud of our teams from LTI and Mindtree coming together for our first global town hall. My focus is on building bridges and creating one unified, collaborative family. People are the heart of this integration. #HR #Culture #Merger #Teamwork","LTIMindtree posts strong Q3 results, showing successful synergy from the merger."
Introduce our AI-powered 'digital twin' platform for manufacturing process optimization.,"Frame it as a long-term, 'strategic' move to create a more 'efficient' system, appealing to his INTJ nature.",Prakash Rao,Chief Digital Officer (CDO) at Tata Motors,INTJ,"[{""role"": ""CDO"", ""company"": ""Tata Motors"", ""duration"": ""2019 - Present"", ""description"": ""Leading the Industry 4.0 and digital transformation initiatives for Tata's manufacturing and supply chain.""}]",Digital Transformation|Industry 4.0|IoT|Data Analytics|Corporate Strategy,The current manufacturing process is full of inefficiencies. We are designing a 10-year digital transformation roadmap. The future is a fully autonomous 'dark factory' run by AI and IoT. This is the only way to compete globally. #DigitalTransformation #Industry40 #Strategy,"Tata Motors announces a $2B investment in its new electric vehicle (EV) subsidiary, 'Tata.ev'."
"Pitch our unified 'omnichannel' customer support platform (voice, chat, email).",Focus on the 'action-oriented' and 'problem-solving' nature of the tool for their support agents.,Varun Agarwal,Head of Customer Experience at Flipkart,ESTP,"[{""role"": ""Head of Customer Experience"", ""company"": ""Flipkart"", ""duration"": ""2020 - Present"", ""description"": ""Leading the customer support and success teams. Focused on reducing resolution time and improving NPS.""}]",Customer Experience (CX)|Customer Support|Operations Management|NPS|Team Leadership,"A customer had a major delivery issue. Got on the call myself, escalated to the hub manager, and got the package delivered in 2 hours. Stop analyzing, start solving. Customers want action, not apologies. #CX #CustomerService #Action",Flipkart introduces a new 30-day 'no-questions-asked' return policy for its 'Flipkart Assured' products.
Offer our 'Ethical ML' consulting to help them build fair and unbiased models.,Directly reference his post on 'values' and building 'responsible' tech.,Rohan Deshmukh,Lead AI Engineer at 'Finclusion' (Social Impact Fintech),INFJ,"[{""role"": ""Lead AI Engineer"", ""company"": ""Finclusion"", ""duration"": ""2021 - Present"", ""description"": ""Building machine learning models for credit scoring for under-served populations. Focusing on ethical AI and bias mitigation.""}]",Machine Learning|Python|AI Ethics|Fintech|Risk Modeling,Wrote a new internal paper on 'Building Responsible AI'. It's not enough for our credit models to be accurate; they must be *fair*. We have a deep responsibility to ensure our technology reflects our values and promotes financial inclusion. #AI #Ethics #Fintech #Impact,Finclusion (social impact startup) is selected for the Bill & Melinda Gates Foundation's 'Financial Inclusion' cohort.
Introduce our new creative brainstorming and mind-mapping software for hybrid teams.,Connect to her 'inspiring' and 'collaborative' post.,Aisha Baig,Innovation Lead at Marico (Innovation Foundation),ENFP,"[{""role"": ""Innovation Lead"", ""company"": ""Marico"", ""duration"": ""2019 - Present"", ""description"": ""Leading open innovation challenges and incubating new product ideas in the CPG and wellness space.""}]",Innovation Management|Design Thinking|Product Development|Corporate Venture,Had an amazing brainstorming session with our new cohort of startups! The energy was incredible. So many possibilities for sustainable packaging. What if we could use seaweed...? Love collaborating with such passionate people! #Innovation #Sustainability #Collaboration,Marico's Parachute brand enters the 'D2C' space with a new line of wellness oils.
"Sell our data lakehouse platform (e.g., Databricks/Snowflake competitor).","Emphasize the 'logical' and 'decoupled' architecture, which will appeal to his INTP nature.",Kunal Shah,Lead Data Engineer at Hotstar (Disney+ Hotstar),INTP,"[{""role"": ""Lead Data Engineer"", ""company"": ""Disney+ Hotstar"", ""duration"": ""2018 - Present"", ""description"": ""Building and maintaining the petabyte-scale data pipelines for streaming analytics and user personalization.""}]",Data Engineering|Apache Spark|Python|SQL|AWS|Big Data|Kafka,"The current data architecture is a mess of coupled ETL jobs. It's logically inefficient. I'm exploring a lakehouse architecture, separating storage (S3/Delta) from compute (Spark). This seems like a much cleaner, more precise system for handling our scale. #DataEngineering #Spark #BigData",Disney+ Hotstar sets a new concurrent streaming record during the ICC Cricket World Cup.
Offer our personalized learning experience platform (LXP) for their employees.,"Highlight how it helps employees 'feel supported' and 'grow', aligning with her ISFJ post.",Priya Sharma,"Manager, Employee Development at HCLTech",ISFJ,"[{""role"": ""Manager, Employee Development"", ""company"": ""HCLTech"", ""duration"": ""2017 - Present"", ""description"": ""Managing upskilling and reskilling programs for the cloud services division. Curating learning paths for new technologies.""}]",Learning & Development|Talent Development|Instructional Design|EdTech,Just wanted to share a quick note to remind everyone of the new certification programs we've made available. Please take the time to invest in your skills. We're here to support your growth! #Learning #Development #HCL,HCLTech partners with Google Cloud to launch a new GenAI CoE for enterprise clients.
Pitch our AI-powered 'Voice of the Customer' analytics platform.,"Show how it can help him 'inspire' his product teams with real, mission-driven user feedback.",Arun Patnaik,Group Product Manager at BYJU'S,ENFJ,"[{""role"": ""Group Product Manager"", ""company"": ""BYJU'S"", ""duration"": ""2019 - Present"", ""description"": ""Leading a team of PMs focused on the core learning app. Defining the product vision and roadmap.""}]",Product Management|EdTech|Product Strategy|Team Leadership|User Growth,What an inspiring week visiting schools and talking to students who use our app. Seeing the 'aha!' moment on a child's face... that's our mission. It's not just about features; it's about changing the future of education in India. #EdTech #Mission #ProductManagement,BYJU'S announces a strategic restructuring to focus on its core 'BYJU'S - The Learning App' product.
Propose our automated event management and marketing platform.,Connect to her post about the 'energy' of events and show how our tool handles the 'boring' logistics.,Neha Singh,Events Marketing Manager at Salesforce India,ESFP,"[{""role"": ""Events Marketing Manager"", ""company"": ""Salesforce"", ""duration"": ""2019 - Present"", ""description"": ""Organizing and executing large-scale marketing events like 'Salesforce World Tour' for the Indian market.""}]",Event Management|Field Marketing|Marketing Strategy|Lead Generation,"That's a wrap on Salesforce World Tour Mumbai! What an incredible event. The energy from our customers and partners was just amazing! Loved connecting with everyone. Now, time to plan the next one! #Events #Marketing #Salesforce",Salesforce announces deeper integration of its 'Einstein GPT' generative AI into its core platform.
Sell our 'Digital Shelf' analytics software to track product visibility and competitor pricing.,Position it as a 'strategic' tool for 'dominating' the e-commerce landscape.,Vikram Rathore,E-commerce Head at Hindustan Unilever (HUL),ENTJ,"[{""role"": ""Head of E-commerce (India)"", ""company"": ""Hindustan Unilever"", ""duration"": ""2020 - Present"", ""description"": ""Driving HUL's e-commerce strategy and sales across all platforms (Amazon, Flipkart, Blinkit). Managing P&L for the online channel.""}]",E-commerce|P&L Management|Digital Marketing|CPG|Sales Strategy|Key Account Management,"E-commerce isn't just a channel; it's the battlefield. Our Q3 results show we've successfully gained 5 points of market share in the 'quick commerce' segment. This was a strategic, data-driven move to dominate the digital shelf. On to Q4. #Ecommerce #Strategy #Leadership #CPG","HUL reports a 15% growth in its e-commerce channel, now contributing to over 10% of total sales."
Pitch our automated CI/CD security testing (DAST/SAST) tool.,Frame it as a 'hands-on' tool that lets him 'break' things in the pipeline *before* they get to production.,Rajat Kumar,Security Engineer (AppSec) at Paytm,ISTP,"[{""role"": ""Security Engineer"", ""company"": ""Paytm"", ""duration"": ""2021 - Present"", ""description"": ""Integrating security into the CI/CD pipeline. Performing static and dynamic analysis of code and running vulnerability scans.""}]",Application Security (AppSec)|DevSecOps|CI/CD|SAST|DAST|Python,"Found a nasty SQL injection vulnerability in a new feature branch. Blocked the PR. Took the code apart, showed the dev how to fix it with parameterized queries. Always better to find the hole yourself before someone else does. #AppSec #DevSecOps #Security",Paytm focuses on core payments business and lending partnerships after RBI restrictions on its payments bank.
Offer our fractional 'Chief Marketing Officer' services for their portfolio companies.,"Show how this 'solves the problem' for their founders who are 'all action, no strategy'.",Anil Bhat,General Partner at Blume Ventures,ESTP,"[{""role"": ""General Partner"", ""company"": ""Blume Ventures"", ""duration"": ""2017 - Present"", ""description"": ""Investing in and mentoring early-stage B2B SaaS and deep-tech startups. Serving on multiple boards.""}]",Venture Capital|Startups|SaaS|DeepTech|Go-to-Market Strategy|Board Member,"So many of our early-stage founders are action-oriented, which is great. But they jump right to tactics without a strategy. They're all 'let's run Facebook ads' without knowing their ICP or positioning. We need to solve this problem pragmatically. #VC #Startups #Strategy",Blume Ventures announces the final close of its new $250M 'Fund IV' to back early-stage Indian startups.
